{
  "character_name": "",
  "player_name": "",
  "archetype": "",
  "career": "",
  
  "characteristics": {
    "brawn": 1,
    "agility": 1,
    "intellect": 1,
    "cunning": 1,
    "willpower": 1,
    "presence": 1
  },
  
  "derived_attributes": {
    "soak_value": 0,
    "wounds": {
      "threshold": 0,
      "current": 0
    },
    "strain": {
      "threshold": 0,
      "current": 0
    },
    "defense": {
      "melee": 0,
      "ranged": 0
    }
  },
  
  "critical_injuries": [],
  
  "skills": [
    {
      "name": "Piloting",
      "characteristic": "agility",
      "rank": 0,
      "career": true,
      "setting_specific": true,
      "description": "Operating planetary or space vehicles."
    }
  ],
  
  "talents_and_abilities": [
    {
      "name": "Quick Draw",
      "type": "talent",
      "tier": 1,
      "description": "Once per round, draw a weapon as an incidental.",
      "reference_page": "Core 74"
    }
  ],
  
  "weapons": [
    {
      "name": "Blaster Pistol",
      "skill": "Ranged (Light)",
      "damage": 6,
      "critical": 3,
      "range": "Medium",
      "special": ["Stun setting"],
      "reference_page": "Core 104"
    }
  ],
  
  "inventory": [
    {
      "name": "Comlink",
      "quantity": 1,
      "encumbrance": 0
    }
  ],
  
  "experience": {
    "total": 0,
    "available": 0
  },
  
  "narrative_profile": {
    "physical_description": "",
    "backstory": "",
    "motivations": {
      "strength": {
        "name": "",
        "description": ""
      },
      "flaw": {
        "name": "",
        "description": ""
      },
      "desire": {
        "name": "",
        "description": ""
      },
      "fear": {
        "name": "",
        "description": ""
      }
    },
    "bonds_and_rivalries": [
      {
        "entity_name": "",
        "relationship_type": "",
        "description": ""
      }
    ]
  }
}
